{
  "kind": "cineweave_codex_temporal_spec",
  "contractVersion": "2.2.0",
  "temporalSpecId": "temporal.rain-courtyard-recognition-v1",
  "version": 1,
  "shotSpecRef": {
    "kind": "cineweave_codex_shot_spec",
    "id": "shot.rain-courtyard-recognition-v1",
    "version": 1,
    "contentHash": "sha256:47ecc379955cbfd7a44c43c6c37b781d10f2aef57f05b0173a4c41d4d199c95f"
  },
  "durationSeconds": 5.5,
  "skillReceipt": {
    "repository": "https://github.com/Wilder1222/cineweave-director",
    "ref": "v3.1.0",
    "commit": "0123456789abcdef0123456789abcdef01234567",
    "installedBy": "codex-environment",
    "usedAt": "2026-08-21T03:40:00.000Z"
  },
  "cameraMotion": {
    "type": "dolly",
    "motivation": "摄影机只在她确认来人身份时靠近，把发现转化为亲密压力。",
    "path": "沿既定视线方向直线推进约二十厘米，不横移、不跨轴。",
    "start": "0 至 1.2 秒完全静止，观察手指和眼神先后变化。",
    "acceleration": "1.2 至 2.0 秒缓慢起步，无可见顿挫。",
    "peak": "2.0 至 3.2 秒保持极低匀速，在三分之四回望完成时达到最近点。",
    "deceleration": "3.2 至 3.8 秒平滑减速。",
    "end": "3.8 至 5.5 秒稳定停留，给目光相接和门槛关系留时间。",
    "framingChange": "从双人中景略收紧到以她为主的中近景，故人仍在背景可识别。"
  },
  "focusTimeline": [
    {
      "eventId": "focus.hand",
      "timeSeconds": 0,
      "description": "焦点覆盖她的手与侧脸，药盒张力可读。"
    },
    {
      "eventId": "focus.eye",
      "timeSeconds": 1.1,
      "description": "焦点明确落在靠镜头的眼睛并保持。"
    },
    {
      "eventId": "focus.hold",
      "timeSeconds": 3.4,
      "description": "不拉焦到故人；通过景深让其身份可识别但保留主次。"
    }
  ],
  "actionTimeline": [
    {
      "eventId": "action.fingers-tighten",
      "timeSeconds": 0.4,
      "ownerRef": "binding.gu-yin-courtyard-01",
      "trigger": "听见熟悉脚步",
      "action": "手指在药盒边缘收紧，眼睛尚未移动。",
      "resultingState": "身体已经反应，但她仍维持表面日常。"
    },
    {
      "eventId": "action.gaze-leads",
      "timeSeconds": 0.8,
      "ownerRef": "binding.gu-yin-courtyard-01",
      "trigger": "脚步停在门槛外",
      "action": "眼神先向右后方移动，下巴约半拍后跟随。",
      "resultingState": "注意力和身体方向开始分离。"
    },
    {
      "eventId": "action.recognition",
      "timeSeconds": 2.6,
      "ownerRef": "binding.gu-yin-courtyard-01",
      "trigger": "看清来人",
      "action": "完成三分之四回望，药盒下降一掌高度，双脚不移动。",
      "resultingState": "她确认身份但保留距离。"
    },
    {
      "eventId": "action.mutual-hold",
      "timeSeconds": 3.6,
      "ownerRef": "binding.lu-cheng-courtyard-01",
      "trigger": "目光相接",
      "action": "故人停止靠近，不跨门槛，只把旧物保持在腰前。",
      "resultingState": "两人进入等待对方先开口的稳定对峙。"
    }
  ],
  "secondaryMotion": [
    "耳坠比头部晚约四分之一拍停止",
    "碎发受庭院残风轻微扫过脸颊",
    "药盒下降时袖口产生一次小幅延迟",
    "故人的湿衣摆在停步后只摆动一次"
  ],
  "dynamicLighting": [
    {
      "eventId": "light.lamp-flicker",
      "timeSeconds": 2.1,
      "description": "油灯产生一次极低幅度自然闪动，只影响右后侧局部暖反射。"
    }
  ],
  "edit": {
    "entry": "从前一镜头的庭院滴水声进入，画面已稳定。",
    "exit": "在两人目光相接后的稳定停留结束，不抢先切入对白。",
    "preferredTransition": "直接切至故人的反应近景或保持下一句对白的反打",
    "soundBridge": "脚步停止后保留檐角滴水和人物一次未完成的吸气。"
  },
  "videoSafeConstraints": [
    "不跨轴或横向漂移",
    "不在推进中改变人物身份与服装结构",
    "耳饰数量和左右位置固定",
    "油灯闪动不改变全局曝光",
    "动作结束后保留至少一秒稳定状态"
  ],
  "endState": "摄影机和人物均稳定；她在门槛内三分之四回望，故人在门槛外，双方已确认身份但无人开口。",
  "validation": {
    "eventsOrdered": true,
    "withinDuration": true,
    "cameraMotivated": true,
    "actionCausal": true,
    "endStateStable": true,
    "visualTemporalSeparated": true
  }
}
